{
  "$id": "https://argus.dev/contracts/functional-api-adaptation-request/v1/schema.json",
  "$schema": "https://json-schema.org/draft/2020-12/schema",
  "$ref": "#/$defs/FunctionalAPIAdaptationRequestV1",
  "$defs": {
    "RepositoryReference": {
      "type": "object",
      "properties": {
        "provider": {
          "type": "string",
          "enum": [
            "github",
            "gitlab",
            "azure-devops",
            "other"
          ]
        },
        "host": {
          "type": "string",
          "minLength": 1,
          "maxLength": 255,
          "pattern": "^[a-z0-9](?:[a-z0-9.-]*[a-z0-9])?$"
        },
        "providerRepositoryId": {
          "type": "string",
          "minLength": 1,
          "maxLength": 255
        },
        "owner": {
          "type": "string",
          "minLength": 1,
          "maxLength": 255
        },
        "name": {
          "type": "string",
          "minLength": 1,
          "maxLength": 255
        }
      },
      "required": [
        "provider",
        "host",
        "providerRepositoryId",
        "owner",
        "name"
      ],
      "additionalProperties": false,
      "description": "A repository reference anchored by the provider-assigned identity; owner and name are mutable display coordinates."
    },
    "Revision": {
      "anyOf": [
        {
          "type": "object",
          "properties": {
            "algorithm": {
              "anyOf": [
                {
                  "type": "string",
                  "enum": [
                    "git-sha1"
                  ]
                }
              ]
            },
            "digest": {
              "type": "string",
              "pattern": "^[0-9a-f]{40}$"
            }
          },
          "required": [
            "algorithm",
            "digest"
          ],
          "additionalProperties": false
        },
        {
          "type": "object",
          "properties": {
            "algorithm": {
              "anyOf": [
                {
                  "type": "string",
                  "enum": [
                    "git-sha256"
                  ]
                }
              ]
            },
            "digest": {
              "type": "string",
              "pattern": "^[0-9a-f]{64}$"
            }
          },
          "required": [
            "algorithm",
            "digest"
          ],
          "additionalProperties": false
        }
      ],
      "description": "An immutable, normalized Git object revision."
    },
    "LocalKey": {
      "type": "string",
      "minLength": 1,
      "maxLength": 63,
      "pattern": "^[a-z][a-z0-9._-]*$",
      "description": "A stable, repository-declared key. It is scoped by its containing repository or parent declaration."
    },
    "FunctionalAPIAdaptationRequestV1": {
      "type": "object",
      "properties": {
        "apiVersion": {
          "anyOf": [
            {
              "type": "string",
              "enum": [
                "argus.dev/functional-api-adaptation-request/v1"
              ]
            }
          ]
        },
        "proposalId": {
          "type": "string",
          "pattern": "^[0-9a-f]{64}$"
        },
        "change": {
          "type": "object",
          "properties": {
            "sourceRepository": {
              "$ref": "#/$defs/RepositoryReference"
            },
            "pullRequest": {
              "type": "object",
              "properties": {
                "number": {
                  "type": "integer",
                  "minimum": 1,
                  "maximum": 9007199254740991
                }
              },
              "required": [
                "number"
              ],
              "additionalProperties": false
            },
            "baseRevision": {
              "$ref": "#/$defs/Revision"
            },
            "headRevision": {
              "$ref": "#/$defs/Revision"
            },
            "observedAt": {
              "type": "string"
            },
            "trigger": {
              "type": "object",
              "properties": {
                "provider": {
                  "anyOf": [
                    {
                      "type": "string",
                      "enum": [
                        "github"
                      ]
                    }
                  ]
                },
                "deliveryId": {
                  "type": "string",
                  "minLength": 1,
                  "maxLength": 255
                },
                "event": {
                  "anyOf": [
                    {
                      "type": "string",
                      "enum": [
                        "pull_request"
                      ]
                    }
                  ]
                },
                "action": {
                  "type": "string",
                  "enum": [
                    "opened",
                    "reopened",
                    "synchronize",
                    "ready_for_review"
                  ]
                }
              },
              "required": [
                "provider",
                "deliveryId",
                "event",
                "action"
              ],
              "additionalProperties": false
            }
          },
          "required": [
            "sourceRepository",
            "pullRequest",
            "baseRevision",
            "headRevision",
            "observedAt",
            "trigger"
          ],
          "additionalProperties": false
        },
        "test": {
          "type": "object",
          "properties": {
            "repository": {
              "$ref": "#/$defs/RepositoryReference"
            },
            "revision": {
              "$ref": "#/$defs/Revision"
            },
            "suiteKey": {
              "$ref": "#/$defs/LocalKey"
            },
            "testKey": {
              "$ref": "#/$defs/LocalKey"
            },
            "name": {
              "type": "string",
              "minLength": 1,
              "maxLength": 255
            },
            "adapter": {
              "$ref": "#/$defs/LocalKey"
            },
            "capabilities": {
              "type": "array",
              "items": {
                "$ref": "#/$defs/LocalKey"
              },
              "minItems": 1,
              "maxItems": 5000
            }
          },
          "required": [
            "repository",
            "revision",
            "suiteKey",
            "testKey",
            "name",
            "adapter",
            "capabilities"
          ],
          "additionalProperties": false
        },
        "endpointRename": {
          "type": "object",
          "properties": {
            "method": {
              "type": "string",
              "enum": [
                "GET",
                "PUT",
                "POST",
                "DELETE",
                "OPTIONS",
                "HEAD",
                "PATCH",
                "TRACE",
                "QUERY"
              ]
            },
            "operationId": {
              "type": "string",
              "minLength": 1,
              "maxLength": 255
            },
            "previousPath": {
              "type": "string",
              "minLength": 1,
              "maxLength": 2048,
              "pattern": "^\\/"
            },
            "path": {
              "type": "string",
              "minLength": 1,
              "maxLength": 2048,
              "pattern": "^\\/"
            },
            "capabilities": {
              "type": "array",
              "items": {
                "$ref": "#/$defs/LocalKey"
              },
              "minItems": 1,
              "maxItems": 50
            }
          },
          "required": [
            "method",
            "operationId",
            "previousPath",
            "path",
            "capabilities"
          ],
          "additionalProperties": false
        }
      },
      "required": [
        "apiVersion",
        "proposalId",
        "change",
        "test",
        "endpointRename"
      ],
      "additionalProperties": false,
      "title": "Argus functional API adaptation request v1",
      "description": "Authoritative endpoint rename evidence and one immutable test supplied to a reviewed source adapter."
    }
  }
}
